{
  "meta": {
    "schema": "project_summary",
    "schema_version": "0.1",
    "revision": 1,
    "created_at": "2026-10-06T12:26:32+09:00",
    "updated_at": "2026-10-06T12:26:32+09:00",
    "updated_by": "pipeline"
  },
  "project_id": "P-SYS-104",
  "week": "2026-W39",
  "project_name": "[합성 예시] 대시보드 시스템 구축",
  "max_lines": 5,
  "week_source_ids": [
    "D-260922-tester-04"
  ],
  "items": [
    {
      "category": "background",
      "text": "보고 자동화 검증을 위해 실제 업무 데이터 없이 파이프라인을 확인하는 합성 과제입니다.",
      "source_ids": [
        "P-SYS-104"
      ],
      "new": false,
      "details": []
    },
    {
      "category": "progress",
      "text": "대시보드 시스템 개발을 완료하고, 다음 단계인 기능 테스트를 준비하고 있습니다.(9/22)",
      "source_ids": [
        "D-260922-tester-04"
      ],
      "new": true,
      "details": []
    },
    {
      "category": "plan",
      "text": "개발을 완료한 대시보드 시스템에 대해 다음 단계인 기능 테스트를 진행할 예정입니다.(~9/25)",
      "source_ids": [
        "D-260922-tester-04"
      ],
      "new": true,
      "details": []
    }
  ],
  "ai": {
    "model": "mock",
    "prompt_id": "project_summary",
    "prompt_version": "v0.7",
    "generated_at": "2026-10-06T12:26:32+09:00",
    "input_revisions": {
      "P-SYS-104": 1,
      "D-260922-tester-04": 1
    },
    "input_hash": "54996ee56c94eff2"
  }
}
