{
  "meta": {
    "schema": "project_summary",
    "schema_version": "0.1",
    "revision": 1,
    "created_at": "2026-10-06T12:26:32+09:00",
    "updated_at": "2026-10-06T12:26:32+09:00",
    "updated_by": "pipeline"
  },
  "project_id": "P-INV-103",
  "week": "2026-W39",
  "project_name": "[합성 예시] 설비 투자",
  "max_lines": 5,
  "week_source_ids": [
    "D-260922-tester-03"
  ],
  "items": [
    {
      "category": "background",
      "text": "보고 자동화 검증을 위해 실제 업무 데이터 없이 파이프라인을 확인하는 합성 과제입니다.",
      "source_ids": [
        "P-INV-103"
      ],
      "new": false,
      "details": []
    },
    {
      "category": "progress",
      "text": "설비 투자 건의 심의를 완료해 다음 단계인 승인·품의 진행을 준비하고 있습니다.(9/22)",
      "source_ids": [
        "D-260922-tester-03"
      ],
      "new": true,
      "details": []
    },
    {
      "category": "plan",
      "text": "심의를 완료한 설비 투자 건에 대해 다음 단계인 승인 품의를 진행할 예정입니다.(~9/25)",
      "source_ids": [
        "D-260922-tester-03"
      ],
      "new": true,
      "details": []
    }
  ],
  "ai": {
    "model": "mock",
    "prompt_id": "project_summary",
    "prompt_version": "v0.7",
    "generated_at": "2026-10-06T12:26:32+09:00",
    "input_revisions": {
      "P-INV-103": 1,
      "D-260922-tester-03": 1
    },
    "input_hash": "52572174db902363"
  }
}
