{
  "meta": {
    "schema": "project_summary",
    "schema_version": "0.1",
    "revision": 1,
    "created_at": "2026-10-06T12:26:32+09:00",
    "updated_at": "2026-10-06T12:26:32+09:00",
    "updated_by": "pipeline"
  },
  "project_id": "P-DAT-105",
  "week": "2026-W39",
  "project_name": "[합성 예시] 수율 개선 분석",
  "max_lines": 5,
  "week_source_ids": [
    "D-260922-tester-05"
  ],
  "items": [
    {
      "category": "background",
      "text": "보고 자동화 검증을 위해 실제 업무 데이터 없이 파이프라인을 확인하는 합성 과제입니다.",
      "source_ids": [
        "P-DAT-105"
      ],
      "new": false,
      "details": []
    },
    {
      "category": "good",
      "text": "수율 데이터 분석을 완료해 수율이 95.0% → 96.0%로 개선된 것을 확인했습니다.(9/22)",
      "source_ids": [
        "D-260922-tester-05"
      ],
      "new": true,
      "details": [
        {
          "text": "분석 결과는 9/30에 공유해 개선 효과를 알릴 예정입니다.",
          "source_ids": [
            "D-260922-tester-05"
          ],
          "new": true
        }
      ]
    },
    {
      "category": "plan",
      "text": "수율 95.0% → 96.0% 개선 분석 결과를 정리해 관련 담당자에게 공유할 예정입니다.(~9/30)",
      "source_ids": [
        "D-260922-tester-05"
      ],
      "new": true,
      "details": []
    }
  ],
  "ai": {
    "model": "mock",
    "prompt_id": "project_summary",
    "prompt_version": "v0.7",
    "generated_at": "2026-10-06T12:26:32+09:00",
    "input_revisions": {
      "P-DAT-105": 1,
      "D-260922-tester-05": 1
    },
    "input_hash": "72869cd522adb833"
  }
}
