{
  "meta": {
    "schema": "project_summary",
    "schema_version": "0.1",
    "revision": 1,
    "created_at": "2026-10-06T12:26:32+09:00",
    "updated_at": "2026-10-06T12:26:32+09:00",
    "updated_by": "pipeline"
  },
  "project_id": "P-APC-101",
  "week": "2026-W39",
  "project_name": "[합성 예시] 자동보정 로직 개선",
  "max_lines": 5,
  "week_source_ids": [
    "D-260922-tester-01"
  ],
  "items": [
    {
      "category": "background",
      "text": "보고 자동화 검증을 위해 실제 업무 데이터 없이 파이프라인을 확인하는 합성 과제입니다.",
      "source_ids": [
        "P-APC-101"
      ],
      "new": false,
      "details": []
    },
    {
      "category": "progress",
      "text": "자동보정 로직 검증을 완료했으며, 불량률이 0.180% → 0.150%로 감소한 것을 확인했습니다.(9/22)",
      "source_ids": [
        "D-260922-tester-01"
      ],
      "new": true,
      "details": []
    },
    {
      "category": "plan",
      "text": "불량률 0.180% → 0.150% 개선을 확인한 자동보정 로직을 양산 라인에 적용할 예정입니다.(~9/30)",
      "source_ids": [
        "D-260922-tester-01"
      ],
      "new": true,
      "details": []
    }
  ],
  "ai": {
    "model": "mock",
    "prompt_id": "project_summary",
    "prompt_version": "v0.7",
    "generated_at": "2026-10-06T12:26:32+09:00",
    "input_revisions": {
      "P-APC-101": 1,
      "D-260922-tester-01": 1
    },
    "input_hash": "09fab5d5c61bfbd8"
  }
}
